{
  "$schema": "./schema/site.schema.json",
  "meta": {
    "name": "Wezigns",
    "legalName": "Wezigns",
    "since": 2012,
    "tagline": "Custom software, built around how your business already works.",
    "description": "Wezigns builds the custom systems that replace the spreadsheets, message threads and manual steps a growing business has outgrown. Operating since 2012 across India, Singapore and the UAE.",
    "email": "hello@wezigns.com",
    "markets": [
      "India",
      "Singapore",
      "UAE"
    ],
    "locale": "en",
    "siteUrl": "https://wezigns.com",
    "og": {
      "image": "/og/wezigns-og.png",
      "imageAlt": "Wezigns — custom software built around how your business already works"
    },
    "TODO_business_facts": {
      "phone": null,
      "whatsapp": null,
      "offices": [],
      "priceBand": null,
      "shapeStagePaid": null,
      "namedClients": [],
      "team": [],
      "certifications": [],
      "note": "Five facts the 200-user study showed carry the remaining intent gap. Fill these and the matching components render automatically; leave null and they stay hidden."
    }
  },
  "nav": {
    "primary": [
      {
        "label": "What we build",
        "href": "/#build"
      },
      {
        "label": "The range",
        "href": "/#range"
      },
      {
        "label": "How we build",
        "href": "/#how"
      },
      {
        "label": "Work",
        "href": "/work"
      },
      {
        "label": "Questions",
        "href": "/#faq"
      }
    ],
    "cta": {
      "label": "Tell us what is not working",
      "short": "Contact",
      "href": "/#contact"
    }
  },
  "hero": {
    "id": "hero",
    "scene": "workarounds",
    "side": "l",
    "headline": {
      "lead": "Custom software,",
      "accent": "built around how your business already works."
    },
    "sub": "Wezigns builds the systems that replace the spreadsheets, message threads and manual steps a growing business has outgrown.",
    "actions": [
      {
        "label": "Tell us what is not working",
        "href": "/#contact",
        "variant": "primary"
      },
      {
        "label": "Explore our work",
        "href": "/work",
        "variant": "secondary"
      }
    ],
    "caption": "Simplify the process. Scale from day one. Build with security in mind.",
    "facts": [
      {
        "label": "Building since",
        "value": "2012"
      },
      {
        "label": "Running at peak",
        "value": "40,000 req/min"
      },
      {
        "label": "Clients in",
        "value": "India · Singapore · UAE"
      }
    ],
    "builtWith": {
      "label": "We build with",
      "items": [
        "Razorpay",
        "Google Cloud",
        "Stripe",
        "AWS"
      ]
    }
  },
  "sections": [
    {
      "id": "build",
      "scene": "disciplines",
      "side": "r",
      "pattern": "sequence",
      "headline": {
        "lead": "What we build,",
        "accent": "and when each one is the answer."
      },
      "items": [
        {
          "n": "01",
          "hue": "blueprint",
          "title": "Custom business software",
          "body": "Software built around a business process that off-the-shelf tools cannot handle well."
        },
        {
          "n": "02",
          "hue": "ochre",
          "title": "Business process automation",
          "body": "Repetitive steps move into the system. The system handles the routine and people handle the exceptions."
        },
        {
          "n": "03",
          "hue": "plum",
          "title": "System integration",
          "body": "We connect the software you already use, so records move between tools without being typed in twice."
        },
        {
          "n": "04",
          "hue": "signal",
          "title": "Data and reporting systems",
          "body": "Your data already exists. We turn it into reports and dashboards people can use without building them by hand."
        },
        {
          "n": "05",
          "hue": "blueprint",
          "title": "Customer and partner platforms",
          "body": "Portals and apps for customers, partners, operators and members."
        },
        {
          "n": "06",
          "hue": "pine",
          "title": "Cloud hosting, support and maintenance",
          "body": "We host, monitor and maintain the systems we build, and take over systems built by others."
        },
        {
          "n": "07",
          "hue": "plum",
          "title": "AI and Gen-AI integrations",
          "body": "AI added to the steps in a process where it saves real work, with a person checking the exceptions."
        },
        {
          "n": "08",
          "hue": "signal",
          "title": "Websites",
          "body": "Websites designed and built one at a time. We have delivered more than 90."
        }
      ],
      "link": {
        "label": "See all capabilities",
        "href": "/capabilities"
      }
    },
    {
      "id": "ai",
      "scene": "intelligence",
      "side": "l",
      "pattern": "statement",
      "headline": {
        "lead": "AI inside the system,",
        "accent": "not beside it."
      },
      "lead": "We build the intelligence into the product itself. It runs on your own data, inside the screens your team already uses, and a person stays in control of the decisions that matter.",
      "link": {
        "label": "Show us your process",
        "href": "/#contact",
        "topic": "new"
      }
    },
    {
      "id": "moment",
      "scene": "onesystem",
      "side": "c",
      "pattern": "statement-proof",
      "statement": {
        "text": "Our systems and products are built for the moment when the business ",
        "emphasis": "outgrows the workaround."
      },
      "link": {
        "label": "Read what changed in each one",
        "href": "/work"
      }
    },
    {
      "id": "principles",
      "scene": "principles",
      "side": "r",
      "pattern": "steps",
      "headline": {
        "lead": "Every system we build",
        "accent": "follows three rules."
      },
      "items": [
        {
          "title": "Simplify",
          "body": "Make complicated work easier to understand and easier to finish.",
          "note": "Fewer steps for the people who use it every day."
        },
        {
          "title": "Scale",
          "body": "Build the first version with the next version in mind.",
          "note": "Start focused. Build the foundation properly. Grow from there."
        },
        {
          "title": "Secure",
          "body": "Design security into the product from the first version.",
          "note": "Then keep reviewing and maintaining it after launch."
        }
      ]
    },
    {
      "id": "range",
      "scene": "range",
      "side": "l",
      "pattern": "sequence",
      "headline": {
        "lead": "The systems a business runs on.",
        "accent": "One way of building them."
      },
      "items": [
        {
          "title": "People & workforce",
          "hue": "",
          "count": 6,
          "systems": [
            "HR and employee records",
            "Payroll and filings",
            "Attendance and leave",
            "Appraisals and goals",
            "Training and certification",
            "Hiring and onboarding"
          ]
        },
        {
          "title": "Revenue & customers",
          "hue": "o",
          "count": 6,
          "systems": [
            "CRM and pipelines",
            "Quotations and pricing",
            "Billing and subscriptions",
            "Support desk and SLAs",
            "Renewals and retention",
            "Partner portals"
          ]
        },
        {
          "title": "Operations & supply chain",
          "hue": "p",
          "count": 6,
          "systems": [
            "Order management",
            "Inventory and stock",
            "Warehouse and picking",
            "Procurement and vendors",
            "Production and work orders",
            "Assets and maintenance"
          ]
        },
        {
          "title": "Finance & governance",
          "hue": "u",
          "count": 6,
          "systems": [
            "Accounts and ledgers",
            "Expenses and claims",
            "Dashboards and reporting",
            "Audit and compliance",
            "Projects and budgets",
            "Documents and approvals"
          ]
        },
        {
          "title": "Industry systems",
          "hue": "s",
          "count": 6,
          "systems": [
            "Hospitals and clinics",
            "Schools and colleges",
            "Property and hotels",
            "Lending and finance",
            "Restaurant and retail POS",
            "Logistics and fleet"
          ]
        }
      ],
      "link": {
        "label": "See all thirty systems",
        "href": "/capabilities#range"
      },
      "countUnit": "systems"
    },
    {
      "id": "how",
      "scene": "stages",
      "side": "r",
      "pattern": "steps",
      "headline": {
        "lead": "Understand. Shape.",
        "accent": "Build. Run.",
        "muteFirst": true
      },
      "lead": "We don't start with technology. We start with the business.",
      "items": [
        {
          "n": "01",
          "hue": "blueprint",
          "title": "Understand",
          "body": "We get inside the process. The people, workflows, systems, dependencies, exceptions, constraints and the outcome the business actually needs.",
          "output": "A clear picture of the problem."
        },
        {
          "n": "02",
          "hue": "ochre",
          "title": "Shape",
          "body": "We turn the problem into a product. What matters now, what can wait, how it should work, and what the architecture has to support.",
          "output": "Scope, priorities, direction, timeline and price."
        },
        {
          "n": "03",
          "hue": "plum",
          "title": "Build",